{
  "estimates": [
    {
      "component": "compute",
      "service_name": "Lambda",
      "pricing_source": "heuristic_fallback",
      "assumptions": [
        "region=us-east-1",
        "pricing_source=heuristic_fallback",
        "requests=100000",
        "memory_mb=256",
        "duration_ms=200"
      ],
      "unit_dimensions": {
        "region": "us-east-1"
      },
      "estimated_monthly_cost_min": 0.08,
      "estimated_monthly_cost_max": 0.16,
      "confidence_score": 0.85,
      "optimization_notes": [
        "Use Price List API for exact pricing when credentials available"
      ],
      "missing_assumptions": []
    },
    {
      "component": "api",
      "service_name": "API Gateway",
      "pricing_source": "heuristic_fallback",
      "assumptions": [
        "region=us-east-1",
        "pricing_source=heuristic_fallback",
        "requests=100000"
      ],
      "unit_dimensions": {
        "region": "us-east-1"
      },
      "estimated_monthly_cost_min": 0.28,
      "estimated_monthly_cost_max": 0.42,
      "confidence_score": 0.85,
      "optimization_notes": [
        "Use Price List API for exact pricing when credentials available"
      ],
      "missing_assumptions": []
    },
    {
      "component": "data",
      "service_name": "DynamoDB",
      "pricing_source": "heuristic_fallback",
      "assumptions": [
        "region=us-east-1",
        "pricing_source=heuristic_fallback",
        "requests=100000",
        "storage_gb=50"
      ],
      "unit_dimensions": {
        "region": "us-east-1"
      },
      "estimated_monthly_cost_min": 10.14,
      "estimated_monthly_cost_max": 16.48,
      "confidence_score": 0.85,
      "optimization_notes": [
        "Use Price List API for exact pricing when credentials available"
      ],
      "missing_assumptions": []
    },
    {
      "component": "storage",
      "service_name": "S3",
      "pricing_source": "heuristic_fallback",
      "assumptions": [
        "region=us-east-1",
        "pricing_source=heuristic_fallback",
        "storage_gb=50"
      ],
      "unit_dimensions": {
        "region": "us-east-1"
      },
      "estimated_monthly_cost_min": 1.03,
      "estimated_monthly_cost_max": 1.38,
      "confidence_score": 0.85,
      "optimization_notes": [
        "Use Price List API for exact pricing when credentials available"
      ],
      "missing_assumptions": []
    }
  ],
  "total_min": 11.53,
  "total_max": 18.44,
  "currency": "USD",
  "pricing_mode": "heuristic"
}